{
  "artifacts": [
    "output.md",
    "pi-output.jsonl",
    "pi-stderr.txt",
    "request.json"
  ],
  "cell_id": "transcript-summary-ollama-nemotron-3-nano-4b-high-summarizer-r1",
  "container": {
    "digest": "sha256:a6738ae527b296a39c93a67748c3d530cbec02f8517d1d0f8774f423be7abc73",
    "image": "localhost/evals-agent",
    "network": "host",
    "runtime": "podman version 5.8.4"
  },
  "execution": {
    "agent_status": "success",
    "exit_code": 0,
    "infrastructure_error": null,
    "session": {
      "response_models": [],
      "stop_reason": "stop",
      "usage": {
        "cache_read": 0,
        "cache_write": 0,
        "input": 1119,
        "output": 323,
        "total_tokens": 1442
      },
      "wall_clock_seconds": 4.213
    }
  },
  "experiment": {
    "id": "exp-002-transcript-summary",
    "kind": "transform-judge",
    "repetition": 1,
    "task_id": "transcript-summary"
  },
  "outcome": {
    "evaluator_exit_code": null,
    "failure_class": "none",
    "scores": {},
    "status": "unscored"
  },
  "run": {
    "collected_at": "2026-08-03T19:22:11Z",
    "origin": "local",
    "repository": null,
    "run_attempt": "1",
    "run_id": "demo",
    "source_sha": "7f4f0f2f285801badd25b871cb866e0d0a6e58b9"
  },
  "schema_version": 2,
  "spec_hash": "sha256:3c2d30aa8d015f630d8c04580f5d9d9fae8a2f34d0782bffd6437bf215424983",
  "variant": {
    "agent": "summarizer",
    "harness": "container-pi",
    "outfitter_version": null,
    "pi_version": "0.80.10",
    "provider": "ollama",
    "requested_model": "nemotron-3-nano:4b",
    "thinking": "high",
    "tools": []
  }
}
